Sales Of iPhones In Eye Of AAPL Earnings,"Ten years ago this month, Apple’s (NYSE: AAPL) then-Chief Executive Steve Jobs first introduced the iPhone to the world, and since then those smartphone sales have been powering the company’s top and bottom lines. But 2016 saw a three-quarter string of ...","https://www.bing.com/cr?IG=FB2E3BE45FC0416B86BA49B45C5134B3&CID=1BA4A0F7FCA160C83FE9ABE2FDFE61C5&rd=1&h=0g85fLiHyFgkcQsIrHTKpvlrmyZpikyJ1Jesi0v3in0&v=1&r=https%3a%2f%2fwww.benzinga.com%2fanalyst-ratings%2fanalyst-color%2f17%2f01%2f8972292%2fsales-of-iphones-in-eye-of-aapl-earnings&p=DevEx,5101.1",2017-01-31T11:33:00
AAPL Shares Fall 7 Percent In NASDAQ After-Hours On Weak Revenue Forecast,"http://www.bing.com/cr?IG=FB2E3BE45FC0416B86BA49B45C5134B3&CID=1BA4A0F7FCA160C83FE9ABE2FDFE61C5&rd=1&h=Dz6dqR0FGO-p6EgB30Tr3yKMP4tbchzmaqUV3lVdzUI&v=1&r=http%3a%2f%2fwww.inquisitr.com%2f2271397%2faapl-shares-fall-7-percent-in-nasdaq-after-hours-on-weak-revenue-forecast%2f&p=DevEx,5103.1","Shares of Apple Inc. (NASDAQ: AAPL) sold-off by close to 7 percent in heavy trading volume in this evening’s NASDAQ after-hours session. The technology giant released its fiscal 2015 third quarter financial results today, reporting earnings of $1.85 per ...",2015-07-22T00:12:31
"http://www.bing.com/cr?IG=FB2E3BE45FC0416B86BA49B45C5134B3&CID=1BA4A0F7FCA160C83FE9ABE2FDFE61C5&rd=1&h=95gxLkOJA990B7n3EAGQn0FBJGvC62opfc6G3xhP6bI&v=1&r=http%3a%2f%2ftickerdistrict.com%2f2016%2f01%2f06%2fdan-as-the-aapl-worm-turns%2f&p=DevEx,5105.1",Dan: As the $AAPL Worm Turns,2016-01-06T03:17:00,Apple (AAPL) shares are down about 19% since Nov 10th. That was the day the stock had its largest one day gap lower since late August on a brokerage report from Credit Suisse suggesting that the company was cutting iPhone 6s orders. Since then the relative ...
"http://www.bing.com/cr?IG=FB2E3BE45FC0416B86BA49B45C5134B3&CID=1BA4A0F7FCA160C83FE9ABE2FDFE61C5&rd=1&h=vxwkbxZHyfuXX3LopLR3TO1zSa8EzpE3a7UKTsVDqFE&v=1&r=http%3a%2f%2fwww.zdnet.com%2farticle%2faapl-shares-buy-on-the-dips%2f&p=DevEx,5107.1",AAPL shares: buy on the dips?,Yesterday's news of Steve Jobs' second medical leave of absence (in as many years) was released while U.S. financial markets were closed in observance of the Martin Luther King day holiday. It also came the day before Apple releases its Q1 2011 financial ...,2011-01-18T00:01:00
2017-01-25T00:35:13,Benjamin Graham taught that Intelligent Investors must do a thorough fundamental analysis of investment opportunities to determine their intrinsic value and inherent risk. This is best done by utilizing a systematic approach to analysis that will ...,"http://www.bing.com/cr?IG=FB2E3BE45FC0416B86BA49B45C5134B3&CID=1BA4A0F7FCA160C83FE9ABE2FDFE61C5&rd=1&h=cNki2bOSmUiDbo25t_J3rHAYA64Wg5_kBmfuy6yrjTA&v=1&r=http%3a%2f%2fwww.moderngraham.com%2f2017%2f01%2f24%2fapple-inc-valuation-january-2017-aapl%2f&p=DevEx,5109.1",Apple Inc Valuation – January 2017 $AAPL
2012-11-19T04:28:00,"After seeing a quarter of its market cap wiped off as shares hit a half-year low, Apple has finally rebounded as investors return to senses with a big rally on Monday. The unexpected sell-off has been “insanely insane”, according to Topeka’s Brian ...","http://www.bing.com/cr?IG=FB2E3BE45FC0416B86BA49B45C5134B3&CID=1BA4A0F7FCA160C83FE9ABE2FDFE61C5&rd=1&h=RyOnM954-JmokAj04Pw-dE164-wvxHUErgyKjRtDSPI&v=1&r=http%3a%2f%2fwww.idownloadblog.com%2f2012%2f11%2f19%2faapl-rebounds%2f&p=DevEx,5111.1",AAPL rebounds from the ‘insanely insane’ sell-off
"On September 11, 2010 I published a post titled FY2011 Analyst Estimates: Why AAPL Is Set To Pop. At the time the post was published AAPL had ended the week's trading at $263.41. Seven months later and with AAPL closing on Friday at $335.06, the share ...",2011-04-10,"http://www.bing.com/cr?IG=FB2E3BE45FC0416B86BA49B45C5134B3&CID=1BA4A0F7FCA160C83FE9ABE2FDFE61C5&rd=1&h=yiodXscxY67af5XVSDDXAXR1v1Dehs51mZ68RDwcGSo&v=1&r=http%3a%2f%2fwww.postsateventide.com%2f2011%2f04%2ffy-2012-analyst-estimates-why-aapl-is.html&p=DevEx,5113.1",FY 2012 Analyst Estimates: Why AAPL Is Set To Pop
2015-08-04,"http://www.bing.com/cr?IG=FB2E3BE45FC0416B86BA49B45C5134B3&CID=1BA4A0F7FCA160C83FE9ABE2FDFE61C5&rd=1&h=id7VjphekGJ5_7COigyd5Pq5m1a6nfQi7bCSYPP54sE&v=1&r=http%3a%2f%2fblog.afraidtotrade.com%2fa-big-drop-and-breakdown-for-apple-aapl-into-target%2f&p=DevEx,5115.1","Apple (AAPL) shares entered distribution mode with a breakdown under support and the 200 day SMA. What’s happening now and what downside support levels are valid targets? Let’s start with a zoomed-in Daily Chart view of Apple (AAPL): First, start with ...",A Big Drop and Breakdown for Apple AAPL into Target
Apple Inc (AAPL.O),"Apple Inc. designs, manufactures and markets mobile communication and media devices, personal computers and portable digital music players. The Company sells a range of related software, services, accessories, networking solutions, and third-party digital ...",2017-09-12,"https://www.bing.com/cr?IG=FB2E3BE45FC0416B86BA49B45C5134B3&CID=1BA4A0F7FCA160C83FE9ABE2FDFE61C5&rd=1&h=srxEqDbujL-0jJmI7TbYn35kjYhZ85zjLGEDj5xSCto&v=1&r=https%3a%2f%2fuk.reuters.com%2fbusiness%2fstocks%2foverview%2fAAPL.O&p=DevEx,5117.1"
"I have a major pet peeve with people who constantly refer to Apple’s stock as “APPL” instead of its true stock ticker, “AAPL”. While it just might make more sense for it to be APPL, the truth is that it’s not. So when I see news media, stock ...",2007-10-08T07:20:00,"Dudes, It’s AAPL, Not APPL!","https://www.bing.com/cr?IG=FB2E3BE45FC0416B86BA49B45C5134B3&CID=1BA4A0F7FCA160C83FE9ABE2FDFE61C5&rd=1&h=jVPx5k80VobIfye_E5vy3R7tctqHIE4aktdw9ArLYfg&v=1&r=https%3a%2f%2fgigaom.com%2f2007%2f10%2f08%2fdudes-its-aapl-not-appl%2f&p=DevEx,5119.1"
The Highly Awaited AAPL Pre-Earnings Analysis,"http://www.bing.com/cr?IG=FB2E3BE45FC0416B86BA49B45C5134B3&CID=1BA4A0F7FCA160C83FE9ABE2FDFE61C5&rd=1&h=IpXMbMAqMZl9r2-6zy6o9IxyRpEfoX1Pfeys96OwyDo&v=1&r=http%3a%2f%2fwww.traderplanet.com%2farticles%2fview%2f169268-the-highly-awaited-aapl-pre-earnings-analysis%2f&p=DevEx,5121.1","Hey, traders the world over. There is one name that likely will reign supreme this week. The fan favorite, the market vixen, the home coming queen, the winner of the iron man: we have AAPL earnings this week. There will be many reports on the actual ...",2016-01-26
"http://www.bing.com/cr?IG=FB2E3BE45FC0416B86BA49B45C5134B3&CID=1BA4A0F7FCA160C83FE9ABE2FDFE61C5&rd=1&h=w8QwLhrwq1KlGa7ylDuqCESiYei7U_JiTjZVEvNXPjs&v=1&r=http%3a%2f%2fwww.onenewspage.com%2fn%2fTechnology%2f75eh1xw6d%2fLIVE-Apple-head-designer-Jony-Ive-talks.htm&p=DevEx,5123.1",LIVE: Apple's head designer Jony Ive talks design in New York (AAPL),"Apple Chief Design Officer Jony Ive will give a rare public talk in New York on Friday. Ive will be discussing design in an interview with New Yorker editor-in-chief David Remnick. The session, ""The Shape of Things to Come,"" is part of the New Yorker's ...",2017-10-06T18:12:00
Apple- Buy on the Pullback,"http://www.bing.com/cr?IG=FB2E3BE45FC0416B86BA49B45C5134B3&CID=1BA4A0F7FCA160C83FE9ABE2FDFE61C5&rd=1&h=V-aukw4yZh4QmdXuc79koJ2RWEJZfhCG2-t6mw6fVJw&v=1&r=http%3a%2f%2fmarkets.financialcontent.com%2fstocks%2fnews%2fread%3fGUID%3d35052969&p=DevEx,5125.1",2017-10-05T11:00:00,"Apple (AAPL) is the world's leading personal technology company; virtually every home in North America now has at least one Apple product, asserts Glenn Rogers, contributing editor to Internet Wealth Builder."
